{
  "dialect": "brain-apps-pack/v1",
  "name": "base",
  "version": "0.1.0",
  "description": "The base pack: what every BrainFoundry instance ships with. The defaults.json shelf (journal, thread-digest, portrait, focus-pad, poker-log, study-room) plus ask. Always installed; other packs may require it.",
  "requires": [],
  "apps": [
    { "id": "journal",       "repo_url": "https://github.com/gregorygerman777-hub/brain-app-journal",       "ref": "HEAD" },
    { "id": "thread-digest", "repo_url": "https://github.com/gregorygerman777-hub/brain-app-thread-digest", "ref": "HEAD" },
    { "id": "portrait",      "repo_url": "https://github.com/gregorygerman777-hub/brain-app-portrait",      "ref": "HEAD" },
    { "id": "focus-pad",     "repo_url": "https://github.com/gregorygerman777-hub/brain-app-focus-pad",     "ref": "HEAD" },
    { "id": "poker-log",     "repo_url": "https://github.com/gregorygerman777-hub/brain-app-poker-log",     "ref": "HEAD" },
    { "id": "study-room",    "repo_url": "https://github.com/gregorygerman777-hub/brain-app-study-room",    "ref": "HEAD" },
    { "id": "ask",           "repo_url": "https://github.com/gregorygerman777-hub/brain-app-ask",           "ref": "v0.1.1" }
  ],
  "tools": [],
  "md": [],
  "compute": null
}
